{
  "format": "axiom-platform-conformance-result-v1",
  "formatVersion": 1,
  "scenarioId": "PLAT-RECOVERY-REPEATED-001",
  "requirementStatus": "SPEC_REQUIREMENT",
  "result": "OBSERVED_AGREEMENT_OPEN",
  "participants": [
    {
      "profileId": "android-instrumentation-reference-v0-1"
    }
  ],
  "checks": [
    {
      "kind": "OBSERVATION_CAPTURED",
      "status": "OBSERVED"
    }
  ],
  "openObservations": [
    {
      "kind": "COMPARATOR_DEFERRED",
      "reason": "shared runner owns expected comparison"
    }
  ],
  "divergence": null,
  "diagnostics": [
    "PHYSICAL_INSTRUMENTATION_RESULT_ATTACHED"
  ]
}
